task_id,task,full_title,description,family,difficulty,expected_tool_calls,distinct_tools,num_inputs,num_outputs,output_types,output_breakdown,price
AO-114,"Lumora ""Dewdrop"" lip-oil color-variant set","Lumora ""Dewdrop"" lip-oil color-variant set: cut out on white, recolor one hero shot into 8 shade variants + spec sheet","Clean up and cut out one raw phone shot of the Dewdrop lip-oil bottle onto a white e-commerce background, then recolor the translucent oil into 8 on-brand shade variants while keeping the metallic collar, cap, and lighting/shadow identical across all of them, and emit a variant spec sheet.",Photo & Image,T2_moderate,23,15,3,3,2,"image×2, PDF×1",~$65 est.
AO-115,Rukmini Silverworks 925 jewelry catalog,Rukmini Silverworks 925 jewelry catalog: batch isolate-on-pure-white with metal grade + consistent 3000px square e-com crops (transparent PNG + white-BG JPEG per SKU),"Batch-process six raw 925-silver SKU photos into consistent, cast-free, pure-#FFFFFF e-commerce images — isolate each piece, grade the metal so it reads crisp, and deliver a transparent PNG plus a 3000x3000 white-background JPEG per SKU.",Photo & Image,T4_expert,47,15,7,4,2,"image×2, data/file×2",~$115 est.
AO-116,Umbra Loft noir concert-series poster art,Umbra Loft noir concert-series poster art: three archival live shots driven to a matched two-tone amber/ink duotone + halftone treatment for print and social,"Take three flat archival live-performance photos and drive all three to a matched noir two-tone (amber-highlight / deep-ink-shadow) duotone treatment with halftone texture and film grain, then deliver each as a print-ready poster-ratio image and a square social crop plus a packaged set and a review board.",Photo & Image,T3_complex,36,12,4,4,3,"image×2, ZIP×1, data/file×1",~$90 est.
AO-117,Marisol Cove boutique-hotel homepage hero,"Marisol Cove boutique-hotel homepage hero: license widescreen stock, crop desktop + mobile banners, grade to warm coastal look, place vectorized logo, InDesign export to web JPEG/PNG + print PDF","License a large widescreen coastal stock photo, crop it into desktop and mobile homepage hero frames, grade both to a warm coastal look, place the client's vectorized Marisol Cove logo, and export web-ready JPEG/PNG banners plus a print-ready PDF proof from the client's authored InDesign banner template.",Photo & Image,T2_moderate,18,15,3,6,4,"image×3, vector(SVG)×1, PDF×1, data/file×1",$15
AO-118,Fizzwild kombucha website hero + banner set,"Fizzwild kombucha website hero + banner set: license oversized stock beverage shots, reframe to exact hero/header/CTA/banner sizes, grade to one cohesive family, deliver web-ready pack + style reference","License oversized beverage/lifestyle stock photos, reframe them DOWN to Fizzwild's desktop-hero / mobile-hero / section-header / CTA-card / promo-banner slots at exact pixel sizes, grade them into one cohesive vibrant family, vectorize and cut out the supplied wordmark, and deliver a web-ready pack plus a style reference so future assets stay consistent.",Photo & Image,T3_complex,29,12,3,10,4,"image×6, data/file×2, vector(SVG)×1, ZIP×1",~$75 est.
AO-119,Harbor Crest Realty website visual refresh,"Harbor Crest Realty website visual refresh: license one large Adobe Stock architecture hero, brand-grade it, crop/reframe into desktop + tablet + mobile heroes, section headers and banner ads, and vectorize the logo for placement","License one large Adobe Stock architecture photograph, brand-grade it to the Harbor Crest palette, then crop/reframe that single graded master into a desktop hero, tablet hero, mobile hero, two section-header strips, and two promo banner sizes, vectorize the client logo, and package the cohesive web-ready set with a font recommendation and a review board.",Photo & Image,T3_complex,22,16,4,11,3,"image×8, data/file×2, vector(SVG)×1",~$65 est.
AO-120,NOURA daily-greens DTC paid-social video ad package,"NOURA daily-greens DTC paid-social video ad package: UGC talking-head mashup cut with multi-hook variants, 9:16 / 1:1 / 16:9 reframes, on-brand caption / callout graphic plates, and a graded scroll-stopper thumbnail","Turn NOURA's batch of raw UGC creator talking-head clips plus product b-roll, a flat wordmark, a thumbnail hero still, a brand color reference, and a hooks/captions brief into a paid-social ad package: an AI mashup master cut plus two tighter hook-variant reels, each reframed to 9:16 / 1:1 / 16:9 (same length), on-brand lower-third and callout graphic plates plus a vector logo, a fully graded scroll-stopper thumbnail, and a caption cue sheet — all copied into one handoff folder with a client share link.",Video & Motion,T4_expert,27,19,10,11,4,"image×4, video×4, data/file×2, vector(SVG)×1",~$75 est.
AO-121,Sable & Finch Realty listing tour,"Sable & Finch Realty listing tour: branded 16:9 master property walkthrough with 9:16 reel + 1:1 square cutdowns, color-match grade reference, YouTube thumbnail, and on-brand lower-third / end-card graphic plates","Turn Sable & Finch Realty's four raw handheld property-walkthrough / exterior clips, flat logo, warm brand look-reference, shot list, and listing copy into a branded listing tour package: a polished ~90s 16:9 master (sequenced best shots), a 9:16 reel and 1:1 square social cutdown, a graded color-match reference the editor matches every clip to, a 1280x720 YouTube thumbnail, a vector logo plus on-brand lower-third and end-card graphic plates and type spec, all packaged onto a Firefly board and into a dated CC handoff folder.",Video & Motion,T4_expert,33,23,8,12,4,"image×5, video×3, data/file×3, vector(SVG)×1",~$90 est.
AO-122,Ember & Oak wood-fired restaurant sizzle reel,"Ember & Oak wood-fired restaurant sizzle reel: warm-graded sizzle cut with 9:16 + 1:1 reframes, menu title-card / price-callout graphic plates, hero cover thumbnail, and an animated logo end-card","Turn Ember & Oak's four raw dish/kitchen b-roll clips, a flat plated-hero still, a flat logo, a menu-callout CSV and a brand brief into a fast, mouth-watering wood-fired sizzle reel — an AI sizzle-cut master plus 9:16 and 1:1 reframes, a warm-graded hero cover thumbnail, on-brand menu title-card / price-callout graphic plates, a vector logo and an animated logo end-card — all packaged into a Creative Cloud handoff folder with a client review link.",Video & Motion,T4_expert,34,26,8,9,4,"video×4, image×3, vector(SVG)×1, data/file×1",$10–$20/hr
AO-123,Meridian Academy online-course explainer edit,"Meridian Academy online-course explainer edit: assemble a talking-head lecture + slide / spreadsheet screencasts into a clean 16:9 lesson master, a 9:16 promo cut, a graded course thumbnail, and intro / lower-third / caption graphic plates","Turn Meridian Academy's raw Lesson 4 material — a talking-head lecture clip plus slide-deck and spreadsheet screencasts, a logo, a brand look-reference, a cut-list brief, and a captions sheet — into a clean 16:9 lesson master (filler trimmed, cut between presenter and slides via a real video_render timeline), a 9:16 promo highlight, a graded 1280x720 course thumbnail (grabbed from the master), and on-brand intro title-card / lower-third / key-point-caption graphic plates plus a vector logo, all packaged onto a Firefly board and into a dated CC handoff folder for the final NLE polish.",Video & Motion,T4_expert,29,20,7,11,4,"image×5, data/file×3, video×2, vector(SVG)×1",~$80 est.
