task_id,task,full_title,description,family,difficulty,expected_tool_calls,distinct_tools,num_inputs,num_outputs,output_types,output_breakdown,price
AO-61,Fun YouTube Podcast,Fun YouTube Podcast: reframed 1080p sizzle cut and a branded graphics kit (lower-third + end-screen + vector logo),"Turn the raw podcast footage into a reframed 1080p YouTube master plus a cold-open sizzle and a fun branded graphics kit (vector logo + lower-third + end-screen as PNG-transparent/vector), delivered separately.",Video & Motion,T2_moderate,18,18,3,9,4,"image×3, data/file×3, video×2, vector(SVG)×1",~$60 est.
AO-62,Variable-Data Event Promo Catalog + Price-Tag Merge…,Variable-Data Event Promo Catalog + Price-Tag Merge (Overset-Safe Auto-Fit Template),"Run our variable-data merge into the auto-fit (shrink-to-fit) InDesign catalog template and the Illustrator price-tag template so long product names no longer overset, prepping the product hero art and licensed background first, and export print-ready PDFs.",Layout & Data,T2_moderate,18,16,6,6,4,"PDF×2, data/file×2, image×1, vector(SVG)×1",~$55 est.
AO-63,Maple Cricket League,"Maple Cricket League — a streetwear cricket league: vectorize the logo system, build the sublimation/screen-print kit artwork, and grade the brand photography into a production-ready package","Turn Maple Cricket League's already-designed raster logo sketches and brand photos into a production-ready package: clean vector marks, a halftone sublimation/screen-print kit treatment, cohesive streetwear color-grade, a cut-out product shot, a wide banner reframed from the graded hero, and an exported, packaged deliverable set.",Layout & Data,T2_moderate,18,15,5,7,4,"image×4, vector(SVG)×1, PDF×1, ZIP×1",~$55 est.
AO-64,Premium skincare packaging,"Premium skincare packaging: retouch hero shot, vectorize logo, render authored dieline + data-merge SKU labels, print-ready PDFs","Take Aurelia Botanics' supplied hero serum photo, logo, authored carton dieline (.ai) + label (.indd) and SKU data, and produce retouched/CMYK-graded imagery, a clean vector logo, data-merged print-ready label PDFs for all 3 SKUs, and high-res mockup assets.",Layout & Data,T3_complex,18,17,7,9,5,"image×4, PDF×2, vector(SVG)×1, link/board×1, data/file×1",~$60 est.
AO-67,Tamil Traditional Service-Promotion Large-Format…,Tamil Traditional Service-Promotion Large-Format Banner Set — Print-Prep & Source-File Production (6 sizes),"Take my supplied Tamil banner master files plus hero photography and brand logo, and produce the complete print-ready production package — graded hero image with print bleed, a clean vector logo, a traditional halftone texture motif, and CMYK 150-dpi PDF/JPEG exports of all six large-format banners — with editable source files alongside.",Layout & Data,T4_expert,28,16,5,10,4,"PDF×6, image×2, vector(SVG)×1, data/file×1",~$75 est.
AO-68,Roadside Coaching-Institute Banner,"Roadside Coaching-Institute Banner: brand-graded hero, vector icon set, halftone geometry + print-ready CMYK PDF export","Prepare every visual asset for the DYNAMIC SOLUTION CLASSES 10ft x 5ft roadside banner — brand-graded student hero, vector subject icons, brand-colour halftone geometry — and export the authored InDesign layout to a print-ready CMYK PDF for large-format flex printing.",Layout & Data,T2_moderate,18,16,4,7,4,"image×4, vector(SVG)×1, PDF×1, data/file×1",~$65 est.
AO-69,TitanSeal Sealants Launch,"TitanSeal Sealants Launch — Logo-System Extension, Swappable SKU Label/Carton Data-Merge, and Print-Ready + Digital Asset Package","Take the approved TitanSeal master logo plus the client's authored InDesign label .indd and Illustrator carton .ai mechanicals, derive the full logo-variant system, data-merge the three SKUs into swappable print-ready label/carton artwork, and output the print PDFs plus a correctly-sized digital-asset pack.",Layout & Data,T3_complex,22,14,5,12,4,"image×8, PDF×2, vector(SVG)×1, link/board×1",~$65 est.
AO-72,Modern Store Graphics Package,"Modern Store Graphics Package — Hero Banner, PDP Assets & Store Decoration","Turn the client's product hero shot, stock backdrop, brand palette, and two authored source templates into a cohesive modern-storefront graphics package: a desktop + mobile hero banner, clean PDP image frames and vector icon/divider assets, and tied-together decoration — delivered as layered source exports plus optimized JPG/PNG.",Photo & Image,T3_complex,24,18,6,8,4,"image×5, vector(SVG)×1, PDF×1, data/file×1",~$65 est.
AO-74,Crumb & Co. wholesale bakery catalog,Crumb & Co. wholesale bakery catalog: prep 12 product photos + InDesign catalog data-merge to a print-ready B2B PDF and hi-res JPEG,"Grade and consistently crop twelve raw bakery product photos, vectorize the Crumb & Co. wordmark, upload the prepped assets, then run the client's authored InDesign catalog template through a data-merge against the wholesale roster CSV to produce a print-ready B2B PDF and a high-resolution JPEG.",Layout & Data,T4_expert,45,11,4,4,3,"image×2, vector(SVG)×1, PDF×1",~$110 est.
AO-75,Northgate Dental Congress 2027,"Northgate Dental Congress 2027: delegate name-badge data-merge from roster CSV into authored InDesign template, print PDF + per-badge proof","Take our approved event wordmark, delegate roster CSV (~1,000 rows) and authored InDesign badge template, prep and vectorize the wordmark plus the four role QR marks, then run an InDesign data-merge to bind every delegate into a personalised name badge and export a print-ready imposed PDF plus a high-res proof.",Layout & Data,T1_simple,20,11,7,5,4,"image×2, vector(SVG)×1, PDF×1, data/file×1",$30
AO-76,Northlantic Insurance auto-insurance rate card,"Northlantic Insurance auto-insurance rate card: InDesign data-merge a supplied premium-tier CSV into the client's authored .indd, refresh the disclosure footer, and export a print-ready PDF + high-res JPEG","Run the client's authored InDesign rate-card template through an InDesign data-merge against a supplied auto-insurance premium-tier CSV, place the on-brand logo and licensed background texture, refresh the compliance disclosure footer, and export a press-ready PDF plus a high-resolution JPEG.",Layout & Data,T1_simple,15,11,5,5,4,"image×2, vector(SVG)×1, PDF×1, data/file×1",~$50 est.
AO-77,Willowfen Press KDP picture-book preflight,Willowfen Press KDP picture-book preflight: audit supplied interior + cover .indd/PDF against KDP print specs and emit a marked-up preflight report,"Audit Willowfen Press's supplied 32-page KDP picture-book interior .indd, its exported interior PDF, and the wraparound cover PDF against the KDP spec sheet — checking trim, bleed, margins, spine width, image resolution and caption overset — and emit a marked-up preflight report plus proof renders that says whether the files will pass KDP preflight.",Layout & Data,T1_simple,13,8,5,5,3,"PDF×3, image×1, data/file×1",$200
AO-78,Hearthstone Brew Co. café menu,Hearthstone Brew Co. café menu: food-photo prep + logo vectorize + InDesign data-merge to print-ready PDF & high-res JPEG,"Grade and consistently crop five raw café food/drink photos, vectorize the Hearthstone Brew Co. wordmark, license a warm kraft-paper texture, then run the client's authored InDesign café-menu template through a data-merge against the menu CSV to produce a print-ready PDF and a high-res JPEG.",Layout & Data,T4_expert,29,17,8,5,4,"image×2, vector(SVG)×1, PDF×1, data/file×1",$45/hr
AO-79,Marlow & Vane property flyer batch,"Marlow & Vane property flyer batch: grade listing photos, vectorize the agency crest, and InDesign data-merge a listings CSV into per-property print flyers (PDF + high-res JPEG)","Grade four raw property photos, vectorize the Marlow & Vane crest, source a subtle linen texture, then run the client's authored InDesign flyer template through a data-merge against a four-listing roster CSV to batch-produce a print-ready PDF and per-listing high-res JPEGs.",Layout & Data,T4_expert,29,17,7,5,4,"image×2, vector(SVG)×1, PDF×1, data/file×1",$100
AO-80,Lanternwood Folk Fest 2026 program booklet,Lanternwood Folk Fest 2026 program booklet: sponsor-logo prep + performer-photo grade + InDesign data-merge to press-ready PDF,"Prep the Lanternwood Folk Fest sponsor logos (vectorize / transparent-cut) and grade the performer press photos, source a kraft cover texture, then run the client's authored multi-page InDesign booklet template through two data-merge passes against the schedule and sponsor CSVs to produce a press-ready PDF and a screen-quality PDF program guide.",Layout & Data,T3_complex,26,16,9,5,4,"PDF×2, image×1, vector(SVG)×1, data/file×1",~$70 est.
AO-81,Nimbadesk SaaS product sell sheets,Nimbadesk SaaS product sell sheets: grade product screenshots + vectorize logo + InDesign data-merge one row per product tier into print PDFs + high-res JPEGs,"Clean up and on-brand-tint three raw product-UI screenshots, vectorize the Nimbadesk logo, then run the client's authored one-page sell-sheet InDesign template through a data-merge against a product-tier CSV to produce a print-ready PDF and a high-res JPEG per tier.",Layout & Data,T2_moderate,23,13,7,5,4,"image×2, vector(SVG)×1, PDF×1, data/file×1",~$65 est.
AO-82,Lumen Quarterly brand-consistency audit,Lumen Quarterly magazine issue: brand-guideline consistency audit of the laid-out pages against the supplied style guide (marked-up findings report),"Audit every page of the laid-out Lumen Quarterly issue proof against the supplied Lumen brand style guide and return a marked-up, page-referenced brand-consistency findings report listing each colour / logo / typography / imagery drift and the exact rule it breaks.",Layout & Data,T1_simple,10,6,4,3,2,"data/file×2, image×1",~$40 est.
AO-83,Halden Sleep mattress catalog pre-merge audit,"Halden Sleep mattress catalog pre-merge audit: validate SKU roster against the authored InDesign merge template, proof-render a sample spread, and emit a fix-list report","Audit Halden Sleep's mattress product roster CSV against the authored InDesign catalog merge template and the mandatory-spec checklist, run a proof data-merge of a sample spread to inspect for blank/overset frames, and emit a per-SKU validation findings report with a prioritized fix-list.",Layout & Data,T1_simple,14,10,16,4,3,"PDF×2, image×1, data/file×1",~$45 est.
AO-84,Verdafix industrial sealant labels,Verdafix industrial sealant labels: per-SKU/variant data-merge of a supplied InDesign label template to print-ready CMYK PDFs + hazard-panel photo prep,"Prep the supplied Verdafix product photos and hazard/barcode graphics, then run the client's authored InDesign master label template through a data-merge against a per-SKU/variant CSV to produce one print-ready CMYK-with-bleed PDF per label variant.",Layout & Data,T2_moderate,21,12,7,5,4,"vector(SVG)×2, image×1, PDF×1, data/file×1",~$60 est.
AO-85,Ironclad parts catalog pre-press audit,"Ironclad parts catalog pre-press audit: merge-proof render, spec-row extraction + CSV cross-check, overset/missing-field findings report","Render our authored InDesign parts-catalog template against the master parts CSV into a proof, then audit it page by page — read back every printed spec row, cross-check it against the source data, and hand back a flagged-pages findings note (each defective page keyed to its issue) plus a findings report calling out overset/clipped part numbers, blank spec cells, and section-count mismatches before we send ~100 pages to print.",Layout & Data,T1_simple,14,9,4,5,2,"data/file×4, PDF×1",~$45 est.
AO-86,Amberleaf Tea Studio,Amberleaf Tea Studio: vectorize two AI-generated tea-brand wordmarks + one ornamental crest into production-ready SVGs and derive a matching stand-up-pouch front-label base panel,"Clean and de-skew the client's three AI-generated tea-brand raster logos, trace them into crisp scalable SVG masters, derive one-color and halftone print variants of the crest, and produce a matching front-facing stand-up-pouch label base panel from the supplied pouch mockup.",Vector & Print,T3_complex,26,15,4,8,3,"vector(SVG)×4, image×2, data/file×2",~$70 est.
AO-87,Little Lighthouse charity tee,Little Lighthouse charity tee: rebuild two raster concept mockups into clean 3-spot-color screen-print separations (front chest + full back) as print-ready vector,"Rebuild the client's two flat raster tee concepts (front chest + full back) into clean, production-ready screen-print separations: isolate each of the 3 approved brand spot colors and force it to its exact PANTONE hex as a solid flat plate, vectorize every color layer, and export per-color separation vectors plus a combined proof PDF.",Vector & Print,T4_expert,36,10,4,10,3,"vector(SVG)×8, PDF×1, data/file×1",$5–$17/hr
AO-88,Ridgeline Rovers FC crest,"Ridgeline Rovers FC crest: clean up a phone-shot patch photo, vectorize the emblem, and build a factory-ready embroidery/patch vector package","Clean up the club's phone photo of a stitched sample crest, vectorize the emblem into razor-sharp scalable art at 3-6 inch patch size, reduce it to flat spot-color separations, and hand back a factory-ready SVG plus exported vector masters and a stitch-color reference gathered into a shared review folder.",Vector & Print,T3_complex,27,17,2,7,3,"vector(SVG)×3, image×2, data/file×2",~$75 est.
AO-89,LUMIÈRE MÉNAGE monochrome beauty brand mark,"LUMIÈRE MÉNAGE monochrome beauty brand mark: vectorize the supplied concept + build the full reversible variant system (master SVG, avatar, stacked lockup, one-color/mono-tint knockouts, print PNGs) with a font recommendation, palette recipe, and usage board","Clean and vectorize LUMIÈRE MÉNAGE's supplied flat monochrome logo concept into an editable SVG master, then assemble the full reversible variant system — black-on-white master, white-on-dark knockout, avatar/PFP crop, stacked lockup, one-color black print PNG, a mono-tint alt, a monochrome palette recipe, a font recommendation, and a usage board — all scalable from avatar to signage.",Vector & Print,T2_moderate,17,13,1,9,3,"image×5, data/file×3, vector(SVG)×1",$25
AO-90,Apexguard Auto Film,Apexguard Auto Film: vectorize the AI-drafted master + two sub-brand marks into production SVGs and assemble a multi-size die-cut vinyl decal sheet on the supplied cut-line template,"Clean and de-skew Apexguard's three AI-drafted PPF/tint logo rasters, trace them into crisp production SVG masters, derive one-color knockouts for vinyl weeding, then assemble a multi-size die-cut vinyl decal/sticker sheet by binding the vector marks and the approved-sizes CSV into the client's authored cut-line template and exporting a press-ready PDF + SVG.",Vector & Print,T4_expert,30,15,5,9,4,"vector(SVG)×5, data/file×2, image×1, PDF×1",$500
AO-91,Maison Valcere jewelry house,Maison Valcere jewelry house: vector & print-readiness audit of the supplied luxury wordmark pack against the brand guideline and press spec (marked-up findings report),"Audit the supplied Maison Valcere luxury wordmark pack (master SVG + raster export) against the brand guideline and the press/foil spec, and return a marked-up, region-referenced vector & print-readiness findings report listing every hairline-stroke, line-weight, palette, kerning and non-print-ready-path defect and the exact rule it breaks.",Vector & Print,T1_simple,16,9,4,3,3,"image×1, PDF×1, data/file×1",~$50 est.
AO-92,Wandergrain Supply screen-print pre-flight,"Wandergrain Supply screen-print pre-flight: audit 4 supplied traveller tee vectors for separation-readiness, registration & spot-color count, emit a marked-up seps report + print-shop go/no-go note","Pre-flight four supplied traveller-themed t-shirt vector graphics for screen-print separation readiness -- verify transparent backgrounds, count distinct spot colors per design, check for registration marks and thin-line survivability, vectorize/inspect to flag raster contamination -- and emit a marked-up per-design seps audit report with a go/no-go recommendation for the exposure room.",Vector & Print,T1_simple,20,10,5,4,3,"image×2, vector(SVG)×1, data/file×1",$15–$35/hr
AO-93,Torqex Industrial nameplate logo pack,"Torqex Industrial nameplate logo pack: print-readiness preflight audit of the supplied vector artwork (open paths, RGB, un-outlined text, stray points) into a marked-up findings report","Preflight-audit the supplied Torqex vector logo pack (.ai/.eps master, SVG, PDF, plus one-colour and reverse variants) against the manufacturer's nameplate print spec and return a marked-up, file-and-region-referenced findings report listing every open path, RGB colour, un-outlined text run, stray point, hairline stroke and background/bleed defect with the exact rule it breaks and a severity.",Vector & Print,T1_simple,16,9,7,3,3,"image×1, PDF×1, data/file×1",~$50 est.
AO-94,Vitalé wellness Reel: cut a captured talking-head…,"Vitalé wellness Reel: cut a captured talking-head into platform-ready 9:16 Reel, 9:16 Short and 1:1 feed cuts — quick-cut highlight, multi-platform resize","Take Vitalé Labs' raw single-take wellness talking-head, auto-cut it into a punchy highlight sizzle at a target duration, then export platform-ready 9:16 Reel, 9:16 Short and 1:1 feed versions plus a hook-and-hashtag post-caption note.",Video & Motion,T1_simple,12,7,3,5,2,"video×4, data/file×1",~$50 est.
AO-95,Voltcast tech-channel delivery QC,Voltcast tech-channel delivery QC: audit the outsourced editor's YouTube master + vertical cut against the channel delivery-spec sheet (timecode-referenced video findings report),"Audit the outsourced editor's Voltcast episode deliverables -- the 16:9 YouTube master and the 9:16 vertical cut -- against the channel's written delivery-spec sheet, and return a timestamp-referenced QC findings report (as a report PDF plus structured JSON) listing every spec drift: duration, resolution/fps, missing intro/outro, unsafe-margin overlays and off-brand text.",Video & Motion,T1_simple,13,7,4,3,3,"image×1, PDF×1, data/file×1",~$45 est.
AO-96,SentinelMesh AI cybersecurity SaaS product video,SentinelMesh AI cybersecurity SaaS product video: brand-graded demo cut with 30s promo + 15s teaser cutdowns and on-brand callout / end-card graphic plates,"Turn SentinelMesh's raw screen recordings, product b-roll, logo, and brand color reference into a polished 90-120s AI-cybersecurity SaaS demo cut plus a 30s promo cutdown and 15s teaser (with a vertical social reframe), and build on-brand lower-third / call-out / graded end-card graphic plates and a vector logo — all packaged onto a Firefly board for the Premiere handoff.",Video & Motion,T3_complex,20,16,7,10,4,"image×4, video×4, vector(SVG)×1, data/file×1",$900
AO-97,Pulsevault club-night recap,"Pulsevault club-night recap: assemble a 30s high-energy sizzle reel from supplied raw footage, graded cover frame + vector logo lockup","Take our raw club-night phone clips plus a hero cover still and venue logo, and assemble a post-ready 30-second high-energy recap: an AI sizzle cut reframed to 1080x1920, an event-info caption sheet, and a fully color-graded cover frame with a crisp vector logo lockup.",Video & Motion,T3_complex,28,18,6,5,4,"data/file×2, image×1, vector(SVG)×1, video×1",~$80 est.
AO-98,Velvet Hour Sessions live-set footage review,"Velvet Hour Sessions live-set footage review: multi-clip raw-concert audit, best-take selection + unusable-clip cull, delivered as a shot-selection log with a flagged-frame contact-sheet PDF","Review every raw concert clip from the Velvet Hour Sessions multi-cam shoot, judge keepers vs unusable takes, and deliver a structured shot-selection log (per-clip verdict, reason, best usable stretch, usability rating, coverage tag) plus a contact-sheet PDF of the flagged best-take frames.",Video & Motion,T1_simple,13,9,14,3,2,"PDF×2, data/file×1",$25
AO-99,Lunara Silver Reel repurpose pack,"Lunara Silver Reel repurpose pack: reframe one product-showcase clip to 9:16 / 1:1 / 16:9, AI sizzle cutdown, caption sheet + vectorized wordmark end-card asset","Take Lunara Silver's one raw vertical pendant-showcase clip, product hero still, and flat wordmark PNG, and repurpose them into a platform pack: 9:16 / 1:1 / 16:9 reframes of the clip (same runtime), an AI sizzle cutdown for the Meta ad, a caption/scheduling sheet, and a graded end-card still with a vectorized wordmark.",Video & Motion,T3_complex,22,16,3,8,4,"video×4, data/file×2, image×1, vector(SVG)×1",~$70 est.
AO-104,Northwind Advisory corporate headshots,Northwind Advisory corporate headshots: batch retouch + grade a 3-frame studio session into LinkedIn/website/print deliverables with clean black-and-white alternates,"Batch-retouch and colour-grade three raw studio headshot frames of one Northwind executive into a consistent set of fully-finished colour portraits, then produce clean black-and-white alternates and the LinkedIn / website / print-ready crops, delivered in one review folder.",Photo & Image,T4_expert,43,13,4,19,2,"image×18, data/file×1",~$105 est.
AO-105,Nocturne Sessions duotone gig poster,Nocturne Sessions duotone gig poster: two-tone artist-photo FX + wordmark vectorize + InDesign template merge to print PDF/JPEG,"Give the raw band press photo a bold two-tone (duotone) FX treatment, vectorize the supplied Nocturne Sessions wordmark, then run the client's authored InDesign gig-poster template through a data-merge against the event-copy CSV to export a print-ready PDF and a high-res JPEG.",Photo & Image,T1_simple,16,15,5,5,4,"image×2, vector(SVG)×1, PDF×1, data/file×1",$25
AO-106,Nordheim Atelier FW26 editorial poster series,Nordheim Atelier FW26 editorial poster series: duotone/halftone grayscale-cutout treatment of four runway looks into print-ready posters,"Cut four raw runway looks off their backgrounds, drive each to a consistent grayscale duotone/halftone editorial treatment with grain and a signature yellow accent, vectorize the wordmark, and run the client's authored InDesign poster template through a data-merge to produce four print-ready poster PDFs and high-res JPEGs.",Photo & Image,T4_expert,40,15,7,5,4,"image×2, vector(SVG)×1, PDF×1, data/file×1",$500
AO-107,Deli & Dough Uber Eats hero banner,"Deli & Dough Uber Eats hero banner: grade + cut out four supplied deli shots, source a butcher-paper backdrop, vectorize the wordmark, and bind into an authored 2880x2304 banner template for print-ready export","Grade four raw deli photos to one cohesive gritty-warm look, cut the hero sandwich onto transparency, source a butcher-paper backdrop, vectorize the Deli & Dough wordmark, and bind all the prepped parts into the client's authored 2880x2304 Illustrator banner template to export a print-ready Uber Eats hero banner.",Photo & Image,T4_expert,29,16,8,5,3,"image×3, vector(SVG)×1, data/file×1",$20–$40/hr
AO-109,Kantyna Nova website photo grade,Kantyna Nova website photo grade: batch-retouch 8 raw restaurant food photos to a cohesive premium look + desktop/mobile crops,"Batch-retouch eight raw restaurant food photos to one cohesive premium color grade, straightened and cleaned up, then deliver desktop (16:9) and mobile (4:5) crops of each plus a review board for owner sign-off.",Photo & Image,T4_expert,39,15,9,5,2,"data/file×3, image×2",~$95 est.
AO-110,Summit & Sable eCommerce catalog,Summit & Sable eCommerce catalog: batch color-grade six product shots to house look + recolor hardware/label accents without reshoot,"Batch color-grade six existing Summit & Sable product photos to one consistent house look, then non-destructively recolor the recovery-strap hardware and label accents on two hero shots — keeping lighting, shadow and texture natural — and export web-ready catalog images plus a review board.",Photo & Image,T3_complex,33,11,7,4,2,"image×3, data/file×1",$8–$45/hr
AO-111,"Restore a Faded, Scratched Family Keepsake Photo to…","Restore a Faded, Scratched Family Keepsake Photo to a Framed A4 Print","Restore one treasured, faded and scratched 1970s family keepsake scan -- correct the color cast and faded contrast, recover clarity/detail, conceal scratches over the plain backdrop -- and deliver a framed-A4 print-ready file with a before/after approval board.",Photo & Image,T1_simple,17,17,1,2,2,"image×1, link/board×1",~$55 est.
AO-112,SlabVault graded-card Shopify batch,"SlabVault graded-card Shopify batch: background removal onto clean white, straighten, center, and 2048x2048 export","Cut six iPhone-shot graded trading-card / hobby-box photos out of their cluttered backgrounds, straighten and tone them, place each on a clean pure-white background, and export a consistent 2048x2048 square set (plus transparent PNG cutouts) named to match the store's Shopify product handles.",Photo & Image,T4_expert,37,10,7,4,2,"image×2, data/file×2",$5–$50/hr
AO-113,Loomhearth flat-lay apparel,Loomhearth flat-lay apparel: batch background cut-outs + consistent mid-gray marketplace pack,"Take six already-shot raw overhead flat-lay apparel photos, straighten and color-true each, cut every garment cleanly off its cluttered surface, place them all onto one consistent flat mid-gray backdrop, and export a high-res + web-ready square marketplace pack.",Photo & Image,T4_expert,49,13,6,4,2,"image×3, data/file×1",~$115 est.
